{
  "$schema": "https://raw.githubusercontent.com/gruncellka/porto-data/refs/heads/main/porto_data/schemas/restrictions.schema.json",
  "file_type": "restrictions",
  "unit": {
    "country_code": "ISO 3166-1 alpha-2",
    "date": "ISO 8601"
  },
  "disclaimer": "Durable destination restrictions for check and resolve. Verify current operator rules before sending.",
  "legal": {
    "UA": {
      "regions": {
        "UA-43": {
          "jurisdictions": {
            "EU": [
              {
                "reference": "https://eur-lex.europa.eu/eli/reg/2014/692/oj",
                "effective_from": "2014-06-23"
              }
            ],
            "CH": [
              {
                "reference": "https://www.seco.admin.ch/seco/en/home/Aussenwirtschaftspolitik_Wirtschaftliche_Zusammenarbeit/Wirtschaftsbeziehungen/exportkontrollen-und-sanktionen/sanktionen-embargos/sanktionsmassnahmen/sanktionen-ukraine.html",
                "effective_from": "2014-06-23"
              }
            ],
            "UA": [
              {
                "reference": "https://zakon.rada.gov.ua/laws/show/1207-18",
                "effective_from": "2014-04-15"
              }
            ]
          },
          "reason": "Regional legal restrictions apply.",
          "description": "Applicable jurisdictional measures cover this region."
        },
        "UA-40": {
          "jurisdictions": {
            "EU": [
              {
                "reference": "https://eur-lex.europa.eu/eli/reg/2014/692/oj",
                "effective_from": "2014-06-23"
              }
            ],
            "CH": [
              {
                "reference": "https://www.seco.admin.ch/seco/en/home/Aussenwirtschaftspolitik_Wirtschaftliche_Zusammenarbeit/Wirtschaftsbeziehungen/exportkontrollen-und-sanktionen/sanktionen-embargos/sanktionsmassnahmen/sanktionen-ukraine.html",
                "effective_from": "2014-06-23"
              }
            ],
            "UA": [
              {
                "reference": "https://zakon.rada.gov.ua/laws/show/1207-18",
                "effective_from": "2014-04-15"
              }
            ]
          },
          "reason": "Regional legal restrictions apply.",
          "description": "Applicable jurisdictional measures cover this region."
        },
        "UA-14": {
          "partial": true,
          "jurisdictions": {
            "EU": [
              {
                "reference": "https://eur-lex.europa.eu/eli/reg/2022/263/oj",
                "effective_from": "2022-02-23"
              }
            ],
            "CH": [
              {
                "reference": "https://www.seco.admin.ch/seco/en/home/Aussenwirtschaftspolitik_Wirtschaftliche_Zusammenarbeit/Wirtschaftsbeziehungen/exportkontrollen-und-sanktionen/sanktionen-embargos/sanktionsmassnahmen/sanktionen-ukraine.html",
                "effective_from": "2022-08-03"
              }
            ],
            "UA": [
              {
                "reference": "https://zakon.rada.gov.ua/laws/show/1207-18",
                "effective_from": "2014-04-15"
              }
            ]
          },
          "reason": "Regional legal restrictions apply.",
          "description": "Applicable jurisdictional measures cover part of this region."
        },
        "UA-09": {
          "partial": true,
          "jurisdictions": {
            "EU": [
              {
                "reference": "https://eur-lex.europa.eu/eli/reg/2022/263/oj",
                "effective_from": "2022-02-23"
              }
            ],
            "CH": [
              {
                "reference": "https://www.seco.admin.ch/seco/en/home/Aussenwirtschaftspolitik_Wirtschaftliche_Zusammenarbeit/Wirtschaftsbeziehungen/exportkontrollen-und-sanktionen/sanktionen-embargos/sanktionsmassnahmen/sanktionen-ukraine.html",
                "effective_from": "2022-08-03"
              }
            ],
            "UA": [
              {
                "reference": "https://zakon.rada.gov.ua/laws/show/1207-18",
                "effective_from": "2014-04-15"
              }
            ]
          },
          "reason": "Regional legal restrictions apply.",
          "description": "Applicable jurisdictional measures cover part of this region."
        },
        "UA-65": {
          "partial": true,
          "jurisdictions": {
            "EU": [
              {
                "reference": "https://eur-lex.europa.eu/eli/reg/2022/1903/oj",
                "effective_from": "2022-10-06"
              }
            ],
            "CH": [
              {
                "reference": "https://www.seco.admin.ch/seco/en/home/Aussenwirtschaftspolitik_Wirtschaftliche_Zusammenarbeit/Wirtschaftsbeziehungen/exportkontrollen-und-sanktionen/sanktionen-embargos/sanktionsmassnahmen/sanktionen-ukraine.html",
                "effective_from": "2022-10-06"
              }
            ],
            "UA": [
              {
                "reference": "https://zakon.rada.gov.ua/laws/show/1207-18",
                "effective_from": "2014-04-15"
              }
            ]
          },
          "reason": "Regional legal restrictions apply.",
          "description": "Applicable jurisdictional measures cover part of this region."
        },
        "UA-23": {
          "partial": true,
          "jurisdictions": {
            "EU": [
              {
                "reference": "https://eur-lex.europa.eu/eli/reg/2022/1903/oj",
                "effective_from": "2022-10-06"
              }
            ],
            "CH": [
              {
                "reference": "https://www.seco.admin.ch/seco/en/home/Aussenwirtschaftspolitik_Wirtschaftliche_Zusammenarbeit/Wirtschaftsbeziehungen/exportkontrollen-und-sanktionen/sanktionen-embargos/sanktionsmassnahmen/sanktionen-ukraine.html",
                "effective_from": "2022-10-06"
              }
            ],
            "UA": [
              {
                "reference": "https://zakon.rada.gov.ua/laws/show/1207-18",
                "effective_from": "2014-04-15"
              }
            ]
          },
          "reason": "Regional legal restrictions apply.",
          "description": "Applicable jurisdictional measures cover part of this region."
        }
      }
    }
  },
  "routing": {
    "CY": {
      "authority": "CY",
      "reference": "https://www.cypruspost.post/en/faq-receive-items",
      "regions": {
        "CY-06": {},
        "CY-01": {
          "partial": true
        },
        "CY-04": {
          "partial": true
        }
      },
      "reason": "Special postal routing applies.",
      "description": "Ordinary items to addressees in the affected areas are forwarded."
    }
  }
}
